{
  "schema_version": "1.0",
  "criteria_weights": {
    "problem_understanding": 0.25,
    "data_processability": 0.15,
    "result_verifiability": 0.20,
    "model_feasibility": 0.15,
    "ai_reliability": 0.25
  },
  "score_scale": {"min": 0, "max": 10, "higher_is_better": true},
  "candidates": [
    {
      "id": "A",
      "title": "烟幕干扰弹的投放策略",
      "criteria": {
        "problem_understanding": {"score": 9, "confidence": "HIGH", "evidence": ["题面明确坐标系、导弹与无人机初始位置、速度范围、重力运动、云团半径/下沉速度/20秒有效期、投放间隔和五层递进任务。", "三个附件模板明确最终决策变量、单位、编号与每弹有效干扰时长。"], "risks": ["‘有效遮蔽’需把有限圆柱真目标、导弹视线与球云几何关系形式化，边界接触是否计入需团队固定。"]},
        "data_processability": {"score": 9, "confidence": "HIGH", "evidence": ["核心数值参数全部由题面给定，不依赖外部数据。", "三个模板均可读，字段与单位明确；模板空值是待填输出而非数据缺失。"], "risks": ["需保持角度制、坐标轴方向、米/秒单位及浮点精度一致。"]},
        "result_verifiability": {"score": 9, "confidence": "HIGH", "evidence": ["问题1给定完整策略，可作为独立基准复算遮蔽时长。", "轨迹方程、速度界、投放间隔、爆炸前抛体运动、云团20秒寿命和几何相交均可做确定性约束检查；多弹结果可逐弹复放。"], "risks": ["连续时间遮蔽区间的数值离散可能漏掉短区间，需事件根求解或步长收敛检查。"]},
        "model_feasibility": {"score": 7, "confidence": "MEDIUM", "evidence": ["单弹解析运动学与几何判定可快速建立，问题1提供基准，问题2至问题5可由同一仿真核复用。", "变量维数随5机、至多15弹和3枚导弹扩大，但可先构造可行基线再采用分层/启发式优化。"], "risks": ["问题5是带分配、时序和连续变量的非凸优化，全局最优证明困难；高质量搜索和稳健性验证有比赛时间风险。"]},
        "ai_reliability": {"score": 8, "confidence": "HIGH", "evidence": ["几乎全部事实由题面数值、模板字段、运动方程和可执行约束锚定，输出可通过复算器检验。", "不需要冷门外部数据库或主观标签。"], "risks": ["AI容易把点目标遮蔽误写成圆柱目标整体遮蔽，或混淆投放时刻与起爆延时；必须由统一判定函数约束。"]}
      },
      "weighted_total": 84.5,
      "uncertainty_range": [80.5, 87.5],
      "hard_stops": [],
      "unknowns": ["队伍能否在限定时间内完成问题5的高维优化与独立复核。", "遮蔽几何边界的最终数学口径须在H1由队伍确认。"]
    },
    {
      "id": "B",
      "title": "碳化硅外延层厚度的确定",
      "criteria": {
        "problem_understanding": {"score": 8, "confidence": "HIGH", "evidence": ["题面清楚要求一次反射模型、厚度算法与可靠性分析、多光束干涉条件/影响/识别/校正。", "附件说明明确四组材料、两种入射角、波数与反射率单位。"], "risks": ["折射率随波长和掺杂变化，但未直接给出色散/载流子参数；采用何种折射率关系会改变绝对厚度。"]},
        "data_processability": {"score": 9, "confidence": "HIGH", "evidence": ["四个工作簿均为单表两列，每个含7469条数据，无缺失，波数从399.6747到4000.122 cm^-1严格递增，步长约0.481至0.483。", "同一材料有10°与15°两组观测，便于交叉核验。"], "risks": ["每组首个反射率为0，附件2峰值超过100%，需判断仪器归一化/边界异常并做敏感性分析。"]},
        "result_verifiability": {"score": 8, "confidence": "MEDIUM", "evidence": ["双入射角可检验同一晶圆厚度一致性；峰间距、频谱/自相关和拟合残差可形成相互独立的验证路径。", "多光束模型可与单光束模型按残差、峰形和参数稳定性比较。"], "risks": ["附件没有认证厚度真值，绝对准确度主要靠物理一致性而非外部真值验证。"]},
        "model_feasibility": {"score": 7, "confidence": "MEDIUM", "evidence": ["峰检测、频域分析、非线性拟合和双角度一致性检查均可在普通计算环境实现。", "一次反射可作为最低充分基线，多光束模型可按诊断结果增量加入。"], "risks": ["色散、相位、基线漂移与多光束效应耦合，可能造成参数不可识别或局部最优；需要物理资料核验。"]},
        "ai_reliability": {"score": 6, "confidence": "MEDIUM", "evidence": ["数据和基本干涉物理可由公式、两角度数据及代码锚定。", "题目所需材料光学常数、色散关系和多光束必要条件属于专业知识，必须查权威资料并逐式核验。"], "risks": ["AI可能杜撰碳化硅/硅折射率参数或把经验峰距公式用于不满足假设的频段。"]}
      },
      "weighted_total": 75.0,
      "uncertainty_range": [69.5, 80.0],
      "hard_stops": [],
      "unknowns": ["能否在赛时获得并正确引用适用波段、掺杂条件下的权威折射率关系。", "无认证真值时可靠性论证能达到的强度。"]
    },
    {
      "id": "C",
      "title": "NIPT的时点选择与胎儿的异常判定",
      "criteria": {
        "problem_understanding": {"score": 8, "confidence": "HIGH", "evidence": ["四问依次要求相关关系、男胎BMI分组与时点、多因素/误差/达标比例扩展、女胎异常判定；4%阈值和风险分段明确。", "题面附录解释A至AE列含义。"], "risks": ["‘潜在风险最小’没有给定数值损失函数；最佳时点、误检漏检代价及人级/记录级口径需要团队定义。"]},
        "data_processability": {"score": 7, "confidence": "HIGH", "evidence": ["工作簿可读：男胎1082条/267人，女胎605条/147人，各31列，字段较完整。", "男胎Y浓度1082条均有值，937条达到4%；数据包含同一孕妇重复检测，可支持纵向建模但必须按人分组验证。"], "risks": ["男胎末次月经缺12条、女胎BMI缺1条；重复测量导致非独立。女胎AB仅67条非空且空白代表无异常，类别不平衡；AE列605条全为‘是’，不能提供健康结局的正负对照。"]},
        "result_verifiability": {"score": 7, "confidence": "MEDIUM", "evidence": ["可按孕妇而非记录划分训练/验证，使用交叉验证、校准、灵敏度/特异度、阈值敏感性和误差扰动检验。", "男胎4%达标阈值与风险时间窗提供明确边界检查。"], "risks": ["女胎异常判定若以AB为标签，AB本身是检测结果而非独立金标准；AE全为‘是’使临床真值验证受限。最优时点也缺少外部临床结局验证。"]},
        "model_feasibility": {"score": 7, "confidence": "MEDIUM", "evidence": ["回归/混合效应或生存分析、分段优化和分类器均有可运行基线，样本规模适中。", "四问可复用统一清洗、孕周解析和按孕妇分组验证管线。"], "risks": ["需要同时处理纵向重复、测序失败/删失、分组优化、测量误差和不平衡分类，统计口径多且易泄漏。"]},
        "ai_reliability": {"score": 6, "confidence": "MEDIUM", "evidence": ["变量定义、阈值和原始数据可锚定大部分计算，模型性能可代码复现。", "医学解释、筛查与诊断边界、损失权重及标签含义仍需权威医学资料和人工审查。"], "risks": ["AI容易把相关性表述成因果、把题面AB检测结果当临床金标准，或提出未经证实的医疗建议。"]}
      },
      "weighted_total": 70.0,
      "uncertainty_range": [64.5, 74.5],
      "hard_stops": [],
      "unknowns": ["题面所称测序失败在数据中的编码规则是否可完全识别。", "团队对潜在风险损失、假阴性/假阳性代价及女胎标签口径的选择。", "能否取得足以支持医学解释的权威资料。"]
    }
  ],
  "ranking": ["A", "B", "C"],
  "method_note": "固定公式：题意理解×2.5 + 数据可处理×1.5 + 结果可检验×2.0 + 模型可实现×1.5 + AI可靠性×2.5。三题采用同一层级证据：完整题面、全部附件结构与可读性、可执行验证路径、领域与赛时风险。区间是对尚未做短原型和团队能力未知的判断性不确定范围，不参与排序。排名仅供H0参考，不构成选择。"
}
